<?xml version='1.0' encoding='ISO-8859-1'?>
<!--
  
   - History:
   -   Tue Aug 17 21:38:37 UTC 2004 modified by jDAL
-->
<PyBaciTest xmlns="urn:schemas-cosylab-com:PyBaciTest:1.0" xmlns:xsi="http://www.w3.org/2001/XMLSchema-instance" xsi:schemaLocation="urn:schemas-cosylab-com:PyBaciTest:1.0 PyBaciTest.xsd">

<stringROProp/>
<stringRWProp/>
<doubleROProp/>
<doubleRWProp/>
<longROProp/>
<longRWProp/>
<longLongROProp/>
<longLongRWProp/>
<uLongLongROProp/>
<uLongLongRWProp/>
<patternROProp/>
<patternRWProp/>
<doubleSeqROProp/>
<doubleSeqRWProp/>
<longSeqROProp/>
<longSeqRWProp/>

<strSeqProp/>

<blarROProp/>
<blarRWProp/>

</PyBaciTest>

